{
  "run_id": "FA1_003",
  "goal": "Create CSV row counter in sandbox with 3 unit tests.",
  "status": "PASS",
  "confidence": 1.0,
  "summary": "Placeholder evaluation: PASS (confidence 1.00)",
  "evidence_files": [],
  "files_changed": [],
  "tests_run": [],
  "risks": [],
  "next_action": "Archive run and proceed to next task.",
  "created_at": "2026-05-25T04:32:19.905105Z"
}
