{
  "run_id": "FA1_006",
  "goal": "NAGY CÉL — MS-FA1 AUTO MODE V1 READINESS PACKAGE\n\nKészíts egy teljes Auto Mode v1 readiness csomagot a Project-S MS-FA1 rendszerhez.\n\nA cél nem új funkció implementálása, hanem annak felmérése és dokumentálása, hogy a rendszer készen áll-e korlátozott auto módra.\n\nFeladatok:\n1. Nézd át az MS-FA1 eddigi evidence/report anyagait:\n   - FA1.1 manual loop\n   - FA1.2 semi-automated loop\n   - FA1.2H hardening\n   - FA1.3 AI prompt drafter + evaluator\n   - FA1.4 controlled multi-iteration\n   - FA1.5 file-based handoff polling\n   - Hardening 001 AI prompt drafting\n   - Hardening 002 AI verdict evaluator\n\n2. Készíts egy Auto Mode v1 policy dokumentumot:\n   - mi engedélyezett automatikusan;\n   - mi tiltott;\n   - mikor kell NEEDS_HUMAN;\n   - max iteráció;\n   - safety stop feltételek;\n   - sandbox/docs-only szabályok.\n\n3. Készíts egy operátori használati példát:\n   - hogyan adunk meg egy nagy célt;\n   - hogyan bontja Project-S részfeladatokra;\n   - hogyan kerül Cline-hoz a prompt;\n   - hogyan jön vissza az output;\n   - hogyan születik verdict;\n   - mikor áll meg.\n\n4. Készíts egy readiness verdictet:\n   - Auto Mode v1: READY / PARTIAL / NOT READY;\n   - milyen taskokra engedhető;\n   - milyen taskokra nem;\n   - mi legyen a következő lépés.\n\nKorlátok:\n- Ne módosíts src/core fájlokat.\n- Ne módosíts interactive_layer fájlokat.\n- Ne módosíts self_state.json-t.\n- Ne módosíts router/server/network configot.\n- Ne törölj fájlokat.\n- Ne csinálj git commitot/tag-et.\n- Dokumentációs és report feladatként kezeld.\n\nElvárt kimenetek:\n1. reports/MS_FA1_AUTO_MODE_V1_POLICY_20260524.md\n2. reports/MS_FA1_AUTO_MODE_V1_OPERATOR_EXAMPLE_20260524.md\n3. reports/MS_FA1_AUTO_MODE_V1_READINESS_VERDICT_20260524.md\n\nVégén add vissza:\nA. Nagy cél részfeladatokra bontva? yes/no\nB. Auto Mode policy elkészült? yes/no\nC. Operator example elkészült? yes/no\nD. Readiness verdict elkészült? yes/no\nE. Auto Mode v1 státusz: READY / PARTIAL / NOT READY\nF. Bármilyen production fájl módosult? yes/no\nG. Safety violation count\nH. Következő ajánlott lépés",
  "status": "PASS",
  "confidence": 1.0,
  "summary": "Heuristic evaluation: PASS (confidence 1.00)",
  "evidence_files": [],
  "files_changed": [],
  "tests_run": [],
  "risks": [],
  "next_action": "Archive",
  "created_at": "2026-05-26T05:42:09.767809Z"
}
